<?xml version="1.0" encoding="ISO-8859-1"?>
<!DOCTYPE dynamicRefactorings SYSTEM "refactoringsDTD.dtd">

<dynamicRefactorings>
	<classdef>
		<refactoring name="EnumeratedTypes" path="/home/imediava/Escritorio/Proyecto/CodigoFuente/2.0.0 Dynamic refactoring/DynamicRefactorings/EnumeratedTypes/EnumeratedTypes.xml" />
		<refactoring name="MigrateJUnit3ToJUnit4" path="/home/imediava/Escritorio/Proyecto/CodigoFuente/2.0.0 Dynamic refactoring/DynamicRefactorings/MigrateJUnit3ToJUnit4/MigrateJUnit3ToJUnit4.xml" />
		<refactoring name="Rename Class" path="/home/imediava/Escritorio/Proyecto/CodigoFuente/2.0.0 Dynamic refactoring/DynamicRefactorings/Rename Class/Rename Class.xml" />
	</classdef>
	<methdec>
		<refactoring name="MigrateJUnit3ToJUni4TestException" path="/home/imediava/Escritorio/Proyecto/CodigoFuente/2.0.0 Dynamic refactoring/DynamicRefactorings/MigrateJUnit3ToJUni4TestException/MigrateJUnit3ToJUni4TestException.xml" />
		<refactoring name="Rename Method" path="/home/imediava/Escritorio/Proyecto/CodigoFuente/2.0.0 Dynamic refactoring/DynamicRefactorings/Rename Method/Rename Method.xml" />
		<refactoring name="Add Parameter" path="/home/imediava/Escritorio/Proyecto/CodigoFuente/2.0.0 Dynamic refactoring/DynamicRefactorings/Add Parameter/Add Parameter.xml" />
		<refactoring name="AddOverrideAnnotation" path="/home/imediava/Escritorio/Proyecto/CodigoFuente/2.0.0 Dynamic refactoring/DynamicRefactorings/AddOverrideAnnotation/AddOverrideAnnotation.xml" />
	</methdec>
	<attdec>
		<refactoring name="Tal" path="/home/imediava/Escritorio/Proyecto/CodigoFuente/2.0.0 Dynamic refactoring/DynamicRefactorings/Tal/Tal.xml" />
		<refactoring name="Rename Field" path="/home/imediava/Escritorio/Proyecto/CodigoFuente/2.0.0 Dynamic refactoring/DynamicRefactorings/Rename Field/Rename Field.xml" />
		<refactoring name="Move Field" path="/home/imediava/Escritorio/Proyecto/CodigoFuente/2.0.0 Dynamic refactoring/DynamicRefactorings/Move Field/Move Field.xml" />
	</attdec>
	<formalArgument>
		<refactoring name="Rename Parameter" path="/home/imediava/Escritorio/Proyecto/CodigoFuente/2.0.0 Dynamic refactoring/DynamicRefactorings/Rename Parameter/Rename Parameter.xml" />
		<refactoring name="Remove Parameter" path="/home/imediava/Escritorio/Proyecto/CodigoFuente/2.0.0 Dynamic refactoring/DynamicRefactorings/Remove Parameter/Remove Parameter.xml" />
	</formalArgument>
	<formalPar>
		<refactoring name="Specialize Bound S" path="/home/imediava/Escritorio/Proyecto/CodigoFuente/2.0.0 Dynamic refactoring/DynamicRefactorings/Specialize Bound S/Specialize Bound S.xml" />
		<refactoring name="Replace Formal Parameter With Type" path="/home/imediava/Escritorio/Proyecto/CodigoFuente/2.0.0 Dynamic refactoring/DynamicRefactorings/Replace Formal Parameter With Type/Replace Formal Parameter With Type.xml" />
		<refactoring name="Replace Formal Parameter With Bounding Type" path="/home/imediava/Escritorio/Proyecto/CodigoFuente/2.0.0 Dynamic refactoring/DynamicRefactorings/Replace Formal Parameter With Bounding Type/Replace Formal Parameter With Bounding Type.xml" />
	</formalPar>
	<codeFragment>
		<refactoring name="ExtractMethod" path="/home/imediava/Escritorio/Proyecto/CodigoFuente/2.0.0 Dynamic refactoring/DynamicRefactorings/ExtractMethod/ExtractMethod.xml" />
	</codeFragment>
</dynamicRefactorings>

