<?xml version="1.0" encoding="ISO-8859-1"?>
<!DOCTYPE dynamicRefactorings SYSTEM "refactoringsDTD.dtd">

<dynamicRefactorings>
	<classdef>
		<refactoring name="EnumeratedTypes" path="..\Documents and Settings\Laura\workspace\2.0.12 Dynamic refactoring\DynamicRefactorings\EnumeratedTypes\EnumeratedTypes.xml" />
	</classdef>
	<methdec>
		<refactoring name="MigrateJUnit3ToJUni4TestException" path="..\Documents and Settings\Laura\workspace\2.0.12 Dynamic refactoring\DynamicRefactorings\MigrateJUnit3ToJUni4TestException\MigrateJUnit3ToJUni4TestException.xml" />
		<refactoring name="Rename Method" path="..\Documents and Settings\Laura\workspace\2.0.12 Dynamic refactoring\DynamicRefactorings\Rename Method\Rename Method.xml" />
	</methdec>
	<formalArgument>
		<refactoring name="Rename Parameter" path="..\Documents and Settings\Laura\workspace\2.0.12 Dynamic refactoring\DynamicRefactorings\Rename Parameter\Rename Parameter.xml" />
	</formalArgument>
	<formalPar>
		<refactoring name="Specialize Bound S" path="..\Documents and Settings\Laura\workspace\2.0.12 Dynamic refactoring\DynamicRefactorings\Specialize Bound S\Specialize Bound S.xml" />
	</formalPar>
</dynamicRefactorings>

