<?xml version="1.0" encoding="ISO-8859-1"?>
<!DOCTYPE dynamicRefactorings SYSTEM "refactoringsDTD.dtd">

<dynamicRefactorings>
	<classdef>
		<refactoring name="EnumeratedTypes" path=".\DynamicRefactorings\EnumeratedTypes\EnumeratedTypes.xml" />
		<refactoring name="MigrateJUnit3ToJUnit4" path=".\DynamicRefactorings\MigrateJUnit3ToJUnit4\MigrateJUnit3ToJUnit4.xml" />
		<refactoring name="Rename Class" path=".\DynamicRefactorings\Rename Class\Rename Class.xml" />
	</classdef>
	<methdec>
		<refactoring name="MigrateJUnit3ToJUni4TestException" path=".\DynamicRefactorings\MigrateJUnit3ToJUni4TestException\MigrateJUnit3ToJUni4TestException.xml" />
		<refactoring name="Rename Method" path=".\DynamicRefactorings\Rename Method\Rename Method.xml" />
		<refactoring name="Add Parameter" path=".\DynamicRefactorings\Add Parameter\Add Parameter.xml" />
		<refactoring name="AddOverrideAnnotation" path=".\DynamicRefactorings\AddOverrideAnnotation\AddOverrideAnnotation.xml" />
	</methdec>
	<attdec>
		<refactoring name="Move Field" path=".\DynamicRefactorings\Move Field\Move Field.xml" />
	</attdec>
	<formalArgument>
		<refactoring name="Rename Parameter" path=".\DynamicRefactorings\Rename Parameter\Rename Parameter.xml" />
		<refactoring name="Remove Parameter" path=".\DynamicRefactorings\Remove Parameter\Remove Parameter.xml" />
	</formalArgument>
	<formalPar>
		<refactoring name="Specialize Bound S" path=".\DynamicRefactorings\Specialize Bound S\Specialize Bound S.xml" />
		<refactoring name="Replace Formal Parameter With Type" path=".\DynamicRefactorings\Replace Formal Parameter With Type\Replace Formal Parameter With Type.xml" />
		<refactoring name="Replace Formal Parameter With Bounding Type" path=".\DynamicRefactorings\Replace Formal Parameter With Bounding Type\Replace Formal Parameter With Bounding Type.xml" />
	</formalPar>
	<codeFragment>
		<refactoring name="ExtractMethod" path=".\DynamicRefactorings\ExtractMethod\ExtractMethod.xml" />
	</codeFragment>
</dynamicRefactorings>

